{
	"$schema": "./public-coverage-matrix.schema.json",
	"scope": "QTI 2.2 Advanced and QTI 3.0 Advanced DELIVERY public clean-room coverage",
	"updated": "2026-07-13",
	"commands": [
		{
			"id": "item-clean-room",
			"description": "Clean-room item fixture and extractor coverage",
			"cwd": ".",
			"args": [
				"test",
				"packages/item-player/tests/conformance/run-fixtures.test.ts",
				"packages/item-player/src/extraction/extractors/conformance.test.ts",
				"packages/item-player/src/extraction/extractors/conformance-qti3-basic.test.ts",
				"packages/item-player/src/extraction/extractors/conformance-qti3-advanced.test.ts"
			]
		},
		{
			"id": "assessment-clean-room",
			"description": "Clean-room assessment-player DELIVERY coverage",
			"cwd": ".",
			"args": [
				"test",
				"--preload",
				"./packages/assessment-player/tests/setup.ts",
				"packages/assessment-player/tests/conformance-qti22-basic.test.ts",
				"packages/assessment-player/tests/conformance-qti22-advanced.test.ts",
				"packages/assessment-player/tests/conformance-qti30-advanced.test.ts",
				"packages/assessment-player/tests/assessment-xml-structure.test.ts"
			]
		},
		{
			"id": "package-clean-room",
			"description": "Clean-room IMS CP and QTI 3 shared content parsing coverage",
			"cwd": ".",
			"args": [
				"test",
				"packages/ims-cp-core/tests/qti3-shared-content.test.ts"
			]
		},
		{
			"id": "item-runtime-clean-room",
			"description": "Clean-room item runtime session, PNP, and catalog behavior coverage",
			"cwd": ".",
			"args": [
				"test",
				"packages/item-player/tests/core/item-session-lifecycle.test.ts",
				"packages/item-player/tests/core/pnp.test.ts",
				"packages/item-player/tests/core/delivery-context.test.ts",
				"packages/item-player/tests/core/stimulusRender.test.ts",
				"packages/item-player/tests/core/stylesheetRender.test.ts",
				"packages/item-player/tests/core/glossaryTriggers.test.ts"
			]
		},
		{
			"id": "mathml-clean-room",
			"description": "MathML rendering coverage",
			"cwd": ".",
			"args": [
				"test",
				"packages/typeset-katex/tests/mathml.test.ts"
			]
		},
		{
			"id": "browser-visible",
			"description": "Targeted Playwright coverage for browser-visible certification behaviors",
			"cwd": "apps/demo",
			"args": [
				"run",
				"test:e2e",
				"--",
				"tests/playwright/public-certification.pw.ts"
			]
		},
		{
			"id": "browser-a11y-stage5",
			"description": "Targeted browser accessibility evidence for QTI 3 PNP/catalog/stimulus behavior",
			"cwd": "apps/demo",
			"args": [
				"run",
				"test:e2e",
				"--",
				"tests/playwright/qti3-stage5-a11y.pw.ts"
			]
		},
		{
			"id": "browser-a11y-assessment",
			"description": "Targeted browser accessibility evidence for assessment shell and timer behavior",
			"cwd": "apps/demo",
			"args": [
				"run",
				"test:e2e",
				"--",
				"tests/playwright/assessment-a11y-behavior.pw.ts"
			]
		}
	],
	"rows": [
		{
			"id": "qti22-advanced-q2",
			"version": "QTI 2.2",
			"level": "Advanced",
			"feature": "Q2 Advanced choiceInteraction validation",
			"officialPath": "qti2.2/Advanced Level/Q2 - Choice Interaction/single-cardinality/",
			"publicTests": [
				"packages/item-player/src/extraction/extractors/conformance.test.ts"
			],
			"fixturePackages": [],
			"e2eRequired": false,
			"commandIds": [
				"item-clean-room"
			],
			"notes": "DELIVERY behavior covered by clean-room choice extraction and QTI 2.2 Basic choice runtime fixtures; official invalid IMPORT-only cases are not public DELIVERY gates."
		},
		{
			"id": "qti22-advanced-q6",
			"version": "QTI 2.2",
			"level": "Advanced",
			"feature": "Q6 gapMatchInteraction",
			"officialPath": "qti2.2/Advanced Level/Q6 - Gap Match Interaction/",
			"publicTests": [
				"packages/item-player/tests/conformance/run-fixtures.test.ts",
				"packages/item-player/src/extraction/extractors/conformance.test.ts",
				"apps/demo/tests/playwright/public-certification.pw.ts"
			],
			"fixturePackages": [
				"packages/item-player/tests/conformance/fixtures/qti22_advanced_q6_gap_match"
			],
			"e2eRequired": true,
			"commandIds": [
				"item-clean-room",
				"browser-visible"
			],
			"notes": "Covers gap choices, gaps, matchMax, scoring, and visible interaction rendering."
		},
		{
			"id": "qti22-advanced-q8",
			"version": "QTI 2.2",
			"level": "Advanced",
			"feature": "Q8 graphicGapMatchInteraction",
			"officialPath": "qti2.2/Advanced Level/Q8 - Graphic Gap Match Interaction/",
			"publicTests": [
				"packages/item-player/tests/conformance/run-fixtures.test.ts",
				"packages/item-player/src/extraction/extractors/conformance.test.ts",
				"apps/demo/tests/playwright/public-certification.pw.ts"
			],
			"fixturePackages": [
				"packages/item-player/tests/conformance/fixtures/qti22_advanced_q8_graphic_gap_match"
			],
			"e2eRequired": true,
			"commandIds": [
				"item-clean-room",
				"browser-visible"
			],
			"notes": "Covers background object extraction, gapText/gapImg choices, hotspots, and browser-visible graphic gap rendering."
		},
		{
			"id": "qti22-advanced-q10",
			"version": "QTI 2.2",
			"level": "Advanced",
			"feature": "Q10 hotspotInteraction",
			"officialPath": "qti2.2/Advanced Level/Q10 - Hotspot/",
			"publicTests": [
				"packages/item-player/tests/conformance/run-fixtures.test.ts",
				"packages/item-player/src/extraction/extractors/conformance.test.ts",
				"apps/demo/tests/playwright/public-certification.pw.ts"
			],
			"fixturePackages": [
				"packages/item-player/tests/conformance/fixtures/qti22_advanced_q10_hotspot"
			],
			"e2eRequired": true,
			"commandIds": [
				"item-clean-room",
				"browser-visible"
			],
			"notes": "Covers single and multiple hotspot selection metadata plus visible hotspot rendering."
		},
		{
			"id": "qti22-advanced-q11",
			"version": "QTI 2.2",
			"level": "Advanced",
			"feature": "Q11 hottextInteraction",
			"officialPath": "qti2.2/Advanced Level/Q11 - Hot-text Interaction/",
			"publicTests": [
				"packages/item-player/tests/conformance/run-fixtures.test.ts",
				"packages/item-player/src/extraction/extractors/conformance.test.ts",
				"apps/demo/tests/playwright/public-certification.pw.ts"
			],
			"fixturePackages": [
				"packages/item-player/tests/conformance/fixtures/qti22_advanced_q11_hottext"
			],
			"e2eRequired": true,
			"commandIds": [
				"item-clean-room",
				"browser-visible"
			],
			"notes": "Covers single/multiple hottext extraction and browser-visible selected state."
		},
		{
			"id": "qti22-advanced-q12",
			"version": "QTI 2.2",
			"level": "Advanced",
			"feature": "Q12 inlineChoiceInteraction",
			"officialPath": "qti2.2/Advanced Level/Q12 - Inline Choice Interaction/",
			"publicTests": [
				"packages/item-player/tests/conformance/run-fixtures.test.ts",
				"packages/item-player/src/extraction/extractors/conformance.test.ts"
			],
			"fixturePackages": [
				"packages/item-player/tests/conformance/fixtures/qti22_advanced_q12_inline_choice"
			],
			"e2eRequired": false,
			"commandIds": [
				"item-clean-room"
			],
			"notes": "Covers inline choice extraction, item body placeholder rendering, and scoring."
		},
		{
			"id": "qti22-advanced-q13",
			"version": "QTI 2.2",
			"level": "Advanced",
			"feature": "Q13 matchInteraction",
			"officialPath": "qti2.2/Advanced Level/Q13 - Match Interaction/",
			"publicTests": [
				"packages/item-player/tests/conformance/run-fixtures.test.ts",
				"packages/item-player/src/extraction/extractors/conformance.test.ts"
			],
			"fixturePackages": [
				"packages/item-player/tests/conformance/fixtures/qti22_advanced_q13_match"
			],
			"e2eRequired": false,
			"commandIds": [
				"item-clean-room"
			],
			"notes": "Covers match sets, maxAssociations, pair cardinality, and scoring."
		},
		{
			"id": "qti22-advanced-i17",
			"version": "QTI 2.2",
			"level": "Advanced",
			"feature": "I17 composite item with full responseProcessing",
			"officialPath": "qti2.2/Advanced Level/I17 - Composite Item/",
			"publicTests": [
				"packages/item-player/tests/conformance/run-fixtures.test.ts",
				"packages/item-player/src/extraction/extractors/conformance.test.ts"
			],
			"fixturePackages": [
				"packages/item-player/tests/conformance/fixtures/qti22_advanced_i17_i9a_composite"
			],
			"e2eRequired": false,
			"commandIds": [
				"item-clean-room"
			],
			"notes": "Covers multiple interactions in one item and custom response processing."
		},
		{
			"id": "qti22-advanced-p7",
			"version": "QTI 2.2",
			"level": "Advanced",
			"feature": "P7 QTI metadata",
			"officialPath": "qti2.2/Advanced Level/P7 \u2013 QTI Metadata/",
			"publicTests": [
				"packages/item-player/src/extraction/extractors/conformance.test.ts"
			],
			"fixturePackages": [],
			"e2eRequired": false,
			"commandIds": [
				"item-clean-room"
			],
			"notes": "No specific DELIVERY criteria; clean-room package metadata passthrough is tracked so the row cannot disappear."
		},
		{
			"id": "qti22-advanced-s3-s4",
			"version": "QTI 2.2",
			"level": "Advanced",
			"feature": "S3/S4 selection and ordering",
			"officialPath": "qti2.2/Advanced Level/S3 and S4/",
			"publicTests": [
				"packages/assessment-player/tests/conformance-qti22-advanced.test.ts",
				"packages/assessment-player/tests/assessment-xml-structure.test.ts"
			],
			"fixturePackages": [],
			"e2eRequired": false,
			"commandIds": [
				"assessment-clean-room"
			],
			"notes": "Covers raw QTI 2.2 assessment XML preservation of ordered nested children, required/fixed flags, selection, ordering, and per-testPart modes. Replacement-clone materialization and dynamic precondition/section/testPart branch execution remain outside this row."
		},
		{
			"id": "qti22-advanced-s5",
			"version": "QTI 2.2",
			"level": "Advanced",
			"feature": "S5 rubricBlock in sections",
			"officialPath": "qti2.2/Advanced Level/S5 - Rubric Block in Sections/",
			"publicTests": [